,year,title,director,cast,genre,producer,link,music,cast_size,imdb
1,1987,Aalappirandhavan,A. S. Pragasam,"Sathyaraj, Ambika, Silk Smitha, Master Tinku",null,Pragaas Productions,/wiki/Aalappirandhavan,Ilaiyaraaja,4,
2,1987,Aankalai Nambathey,K. Alex Pandian,"Pandiyan, Rekha, Ramya Krishnan, Senthil, V. K. Ramasamy, S. S. Chandran",null,Alamu Movies,/wiki/Aankalai_Nambathey,Devendran,6,
3,1987,Aayusu Nooru,Ponmani Rajan,"Pandiyan, Pandiarajan, Ranjini, Senthil, Kovai Sarala",null,Sampath Creations,/wiki/Aayusu_Nooru,T. Rajendar,5,
4,1987,Anand,C. V. Rajendran,"Prabhu, Radha, Jayashree, Chinni Jayanth",null,Sivaji Productions,/wiki/Anand_(1987_film),Ilaiyaraaja,4,5.0
5,1987,Ananda Aradhanai,Dinesh Baboo,"Mohan, Suhasini, Lizy, Srividya, Senthil, Kovai Sarala",null,Jai Krishna Combines,/wiki/Ananda_Aradhanai,Manoj Gyan,6,
6,1987,Anbulla Appa,A. C. Tirulokchandar,"Sivaji Ganesan, Nadhiya, Rahman, V. K. Ramasamy, Y. G. Mahendra, Manorama, Sangeetha, Baby Sujitha",null,AVM Productions,/wiki/Anbulla_Appa,Sankar Ganesh,8,6.2
7,1987,Anjatha Singam,M. R. Vijaychander,"Prabhu, Sathyaraj, Nalini, Jaishankar, Silk Smitha, Anuradha, Senthil, Vanitha",null,Karthik Arts,/wiki/Anjatha_Singam,Sankar Ganesh,8,
8,1987,Arul Tharum Ayyappan,Dasarathan,"Pandiyan, M. Viswanathan, Rekha, Raghuvaran, Senthil",null,Sri Balamurugan Film Circuit,/w/index.php?title=Arul_Tharum_Ayyappan&action=edit&redlink=1,Dhinakar,5,
9,1987,Aval Mella Sirithal,M. N. Jai Sundar,"Murali, Seetha, Madhuri, S. S. Chandran, Chinni Jayanth, Charle",null,Sri Kavitha Cine Arts,/wiki/Aval_Mella_Sirithal,Gangai Amaran,6,
10,1987,Chellakutti,K. Natraj,"Suresh, Jayashree, Sarath Babu, Sujatha",null,Dhandayudhapani Films,/w/index.php?title=Chellakutti&action=edit&redlink=1,Gangai Amaran,4,
11,1987,Chinna Kuyil Paaduthu,P. Madhavan,"Sivakumar, Ambika, Ilavarasi, Cho, Senthil, Manorama, Kovai Sarala, Master Tinku",null,Karpagam Films,/wiki/Chinna_Kuyil_Paaduthu,Ilaiyaraaja,8,4.6
12,1987,Chinna Poove Mella Pesu,Robert - Rajasekhar,"Prabhu, Ramki, Narmadha, Shubha, Sudha Chandran, Sabitha Anand, Chinni Jayanth",null,Ess Kay Film Combines,/wiki/Chinna_Poove_Mella_Pesu,"S. A. Rajkumarst movie
",7,
13,1987,Chinna Thambi Periya Thambi,Manivannan,"Sathyaraj, Prabhu, Nadhiya, Nizhalgal Ravi, Sudha Chandran",null,Semba Creations,/wiki/Chinna_Thambi_Periya_Thambi,Gangai Amaran,5,6.0
14,1987,Cooliekkaran,Rajasekhar,"Vijayakanth, Jaishankar, Srividya, Rupini, Radha Ravi, Silk Smitha, Nagesh, S. S. Chandran",null,Kalaippuli International,/wiki/Cooliekkaran,T. Rajendar,8,
15,1987,Dhoorathu Pachai,Manobala,"Karthik, Suhasini, Thulasi",null,Sri Lakshmi Art Movies,/wiki/Dhoorathu_Pachai,Ilaiyaraaja,3,6.2
16,1987,Elangeswaran,T. R. Ramanna,"K. R. Vijaya, Rajesh, Revathi, Srividya, Sripriya",null,Sri Sivakami Productions,/w/index.php?title=Elangeswaran_(film)&action=edit&redlink=1,M. S. Viswanathan,5,6.7
17,1987,Ellaikodu,K. Jothipandiyan,"Saritha, Rajesh, Radha Ravi",null,S. S. G. Films,/w/index.php?title=Ellaikodu&action=edit&redlink=1,Sankar Ganesh,3,
18,1987,Enga Chinna Rasa,K. Bhagyaraj,"K. Bhagyaraj, Radha, C. R. Saraswathy",null,Sri Amman Creations,/wiki/Enga_Chinna_Rasa,Sankar Ganesh,3,6.6
19,1987,Enga Ooru Pattukaran,Gangai Amaran,"Ramarajan, Rekha, Nishanthi, S. S. Chandran, Senthil, Kovai Sarala",null,Meenakshi Arts,/wiki/Enga_Ooru_Pattukaran,Ilaiyaraaja,6,5.5
20,1987,Enga Veettu Ramayanan,K. Chozha Rajan,"Karthik, S. Ve. Shekher, Ilavarasi, Mahalakshmi, S. S. Chandran, Vanitha",null,Anil Creations,/w/index.php?title=Enga_Veettu_Ramayanan&action=edit&redlink=1,Sankar Ganesh,6,5.6
21,1987,Etikku Potti,R. Govindarajan,"Pandiarajan, Saritha, Chithrangi, Rajeev",null,Murali Cine Arts,/w/index.php?title=Etikku_Potti&action=edit&redlink=1,Gangai Amaran,4,
22,1987,Evargal Indiyargal,S. Jagadeesan,"Ramarajan, Madhuri, Lakshmi, Senthil",null,Oaam Selvi Arts,/wiki/Evargal_Indiyargal,Manoj Gyan,4,
23,1987,Gramatthu Minnal,K. Rangaraj,"Ramarajan, Revathi, Raja, Goundamani",null,Keerthana Creations,/wiki/Gramatthu_Minnal,Ilaiyaraaja,4,
24,1987,Idhu Oru Thodar Kathai,Anu Mohan,"Mohan, Amala, Rekha, Goundamani, Senthil",null,Royal India Creations,/wiki/Idhu_Oru_Thodar_Kathai,Gangai Amaran,5,
25,1987,Ini Oru Sudhanthiram,Manivannan,"Sivakumar, Nalini, Chandrasekhar, Pandiyan, Rekha, Raja, Jeevitha, Sulakshana, Janagaraj, Senthil, Kovai Sarala",null,Kalaikovil,/wiki/Ini_Oru_Sudhanthiram,Gangai Amaran,11,
26,1987,Iniya Uravu Poothathu,C. V. Sridhar,"Suresh, Nadhiya, S. Ve. Shekher, Babita, Cho",null,Sri Rajakaliamman Productions,/wiki/Iniya_Uravu_Poothathu,Ilaiyaraaja,5,
27,1987,Ival Oru Pournami,T. P. K.,"Raveendran, Seetha, Rooplatha, Sri Raman",null,T. P. K. Productions,/w/index.php?title=Ival_Oru_Pournami&action=edit&redlink=1,T. K. Ramamoorthy,4,
28,1987,Ivargal Varungala Thoongal,Venkat,"Prabhu, Ambika, Raghuvaran, Jaishankar, Jayachitra, Nagesh, Disco Shanti",null,Perfect Productions,/wiki/Ivargal_Varungala_Thoongal,T. Rajendar,7,
29,1987,Jallikattu,Manivannan,"Sivaji Ganesan, Sathyaraj, Radha, Janagaraj",null,Seetha Lakshmi Art Films,/wiki/Jallikattu_(1987_film),Ilaiyaraaja,4,6.7
30,1987,Kaani Nilam,S. Arunmozhi,"Kalairani, Nassar, Delhi Ganesh",null,Latha Creations,/w/index.php?title=Kaani_Nilam&action=edit&redlink=1,Arun,3,
31,1987,Kadamai Kanniyam Kattupaadu,Santhana Bharathi,"Sathyaraj, Nalini, Jeevitha, Geetha",null,Raaj Kamal Films International,/wiki/Kadamai_Kanniyam_Kattupaadu,Ilaiyaraaja,4,7.8
32,1987,Kadhal Parisu,A. Jagannathan,"Kamal Haasan, Ambika, Radha, Jaishankar, Janagaraj, Kovai Sarala",null,Sathya Movies,/wiki/Kadhal_Parisu,Ilaiyaraaja,6,6.1
33,1987,Kalyana Kacheri,Manivannan,"Arjun, Ilavarasi, Senthil, Anuradha, Chinni Jayanth",null,Suriyaraj Combines,/w/index.php?title=Kalyana_Kacheri_(1987_film)&action=edit&redlink=1,Ilaiyaraaja,5,
34,1987,Kathai Kathayam Karanamam,Y. G. Mahendra,"Y. G. Mahendra, Pallavi, Jaishankar, Visu, Manorama",null,Sri Lakshmi Jyothi Movies,/w/index.php?title=Kathai_Kathayam_Karanamam&action=edit&redlink=1,M. S. Viswanathan,5,
35,1987,Kavalan Avan Kovalan,Visu,"Prabhu, Rekha, Madhuri, Visu, Prameela, Kalaranjini",null,K. R. G. Film Circuit,/wiki/Kavalan_Avan_Kovalan,Vijay Anand,6,5.2
36,1987,Kavithai Paada Neramillai,Yugi Sethu,"Amala, Raghuvaran, Yugi Sethu, Nassar",null,Maayas Cope Film Company,/wiki/Kavithai_Paada_Neramillai,L. Vaidyanathan,4,
37,1987,Kizhakku Africavil Sheela,Dwarakish,"Suresh, Shakeela, Senthil, Kovai Sarala",null,Dwarakish Chithra,/wiki/Kizhakku_Africavil_Sheela,Bappi Lahiri,4,
38,1987,Kootu Puzhukkal,R. C. Sakthi,"Raghuvaran, Amala, Chandrasekhar, Y. Vijaya",null,Palayee Amman Art Creations,/wiki/Kootu_Puzhukkal,M. S. Viswanathan,4,
39,1987,Krishnan Vandhaan,K. Vijayan,"Sivaji Ganesan, Mohan, Rekha, Thengai Srinivasan",null,S. L. S. Productions,/wiki/Krishnan_Vandhaan,Ilaiyaraaja,4,
40,1987,Makkal En Pakkam,Karthick Raghunath,"Sathyaraj, Ambika, Rajesh, Nagesh, Janagaraj, Manorama, Anuradha",null,Suresh Arts,/wiki/Makkal_En_Pakkam,Chandrabose,7,5.8
41,1987,Manaivi Ready,Pandiarajan,"Pandiarajan, Debashree Roy, K. A. Thangavelu, R. S. Manohar, Manorama",null,Rathnam Art Movies,/wiki/Manaivi_Ready,Ilaiyaraaja,5,6.8
42,1987,Manathil Uruthi Vendum,K. Balachandar,"Suhasini, Sridhar, S. P. Balasubrahmanyam, Ramesh Aravind",null,Kavithalayaa Productions,/wiki/Manathil_Uruthi_Vendum,Ilaiyaraaja,4,6.9
43,1987,Mangai Oru Gangai,Hariharan,"Saritha, Suresh, Nadhiya",null,Motherland Pictures,/wiki/Mangai_Oru_Gangai,Laxmikant–Pyarelal,3,
44,1987,Manithan,S. P. Muthuraman,"Rajinikanth, Rupini, Srividya, Raghuvaran, Madhuri, Cho, Senthil",null,AVM Productions,/wiki/Manithan_(1987_film),Chandrabose,7,6.5
45,1987,Meendum Mahaan,Uthaman,"Pandiarajan, Murali, Rahman, Rekha, Madhuri, S. Ve. Shekher, Aruna",null,Rathnam Cine Arts,/w/index.php?title=Meendum_Mahaan&action=edit&redlink=1,V. Kumar,7,
46,1987,Megam Karuththirukku,Rama Narayanan,"Prabhu, Rekha, S. S. Chandran",null,Sri Thenandal Films,/wiki/Megam_Karuththirukku,Manoj Gyan,3,
47,1987,Michael Raj,V. C. Guhanathan,"Raghuvaran, Madhuri, Sarath Babu, Sumithra, Senthil, Viji, Baby Shalini",null,Suresh Productions,/wiki/Michael_Raj,Chandrabose,7,
48,1987,Mupperum Deviyar,K. Shankar,"K. R. Vijaya, Sujatha, Lakshmi, Prabhu, Ambika, Senthil",null,Ammu Creations,/wiki/Mupperum_Deviyar,M. S. Viswanathan,6,
49,1987,Muthukkal Moondru,A. Jagannathan,"Sivaji Ganesan, Sathyaraj, Pandiarajan, Ranjini, Thengai Srinivasan, Manorama, Baby Sujitha",null,Padmam Production,/wiki/Muthukkal_Moondru,T. Rajendar,7,5.8
50,1987,My Dear Lisa,Baby,"Nizhalgal Ravi, Sadhana, Jaya Rekha, Manorama",null,Asha Creations,/wiki/Veendum_Lisa,Reghu Kumar,4,
51,1987,Nalla Pambu,Rama Narayanan,"Karthik, Ambika, Madhuri, S. S. Chandran, Senthil, Kovai Sarala",null,Eagle Productions,/w/index.php?title=Nalla_Pambu&action=edit&redlink=1,Sankar Ganesh,6,
52,1987,Nayakan,Mani Ratnam,"Kamal Haasan, Saranya, Karthika, Janagaraj, Nassar, Nizhalgal Ravi, Thara",null,Muktha Films,/wiki/Nayakan,Ilaiyaraaja,7,8.6
53,1987,Neethikku Thandanai,S. A. Chandrasekhar,"Raadhika, Ravichandran, Srividya, Nizhalgal Ravi, Charan Raj, Senthil, S. S. Chandran, Kovai Sarala",null,Lalithanjali Fine Arts,/wiki/Neethikku_Thandanai,M. S. Viswanathan,8,
54,1987,Neram Nalla Irukku,Manoj Kumar,"Ramarajan, Nishanthi, Janagaraj, Senthil, Vidya Venugopal, Deepa",null,Srini Creations,/w/index.php?title=Neram_Nalla_Irukku&action=edit&redlink=1,M. S. Viswanathan,6,
55,1987,Nilavai Kayil Pudichen,Rama Narayanan,"Chandrasekhar, Seetha",null,United International,/w/index.php?title=Nilavai_Kayil_Pudichen&action=edit&redlink=1,Sankar Ganesh,2,
56,1987,Ninaikka Therintha Manamey,I. Suresh,"Mohan, Rupini, Chandrasekhar",null,Sivadharani Movies,/w/index.php?title=Ninaikka_Therintha_Manamey&action=edit&redlink=1,Ilaiyaraaja,3,
57,1987,Ninaive Oru Sangeetham,K. Rangaraj,"Vijayakanth, Radha, Srividya, Rekha, Goundamani, Senthil, Kovai Sarala",null,V. N. S. Films,/wiki/Ninaive_Oru_Sangeetham,Ilaiyaraaja,7,5.8
58,1987,Ondru Engal Jathiye,Ramarajan,"Ramarajan, Nishanthi, Ravichandran, Sulakshana, Senthil, S. S. Chandran",null,Sri Devi Bagavathi Films,/w/index.php?title=Ondru_Engal_Jathiye&action=edit&redlink=1,Gangai Amaran,6,9.2
59,1987,Oor Kuruvi,O. S. Sivakumar,"Arun Pandian, Srividya, Madhavi",null,Mass Productions,/w/index.php?title=Oor_Kuruvi_(film)&action=edit&redlink=1,Gangai Amaran,3,6.9
60,1987,Oorkavalan,Manobala,"Rajinikanth, Raadhika, Pandiyan, Y. G. Mahendra, Chithra",null,Sathya Movies,/wiki/Oorkavalan,Sankar Ganesh,5,6.5
61,1987,Ore Raththam,K. Sornam,"Karthik, Pandiyan, Seetha, Madhuri, M. K. Stalin, Kismu, Manorama",null,Murasu Movies,/wiki/Ore_Raththam,Devendran,7,7.3
62,1987,Oru Thayin Sabhatham,T. Rajendar,"T. Rajendar, Srividya, Nizhalgal Ravi, S. S. Chandran",null,Chimbu Cine Arts,/wiki/Oru_Thayin_Sabhatham,T. Rajendar,4,4.4
63,1987,Paadu Nilave,K. Rangaraj,"Mohan, Nadhiya, Ravichandran, Senthil",null,Krishnalaya Productions,/wiki/Paadu_Nilave,Ilaiyaraaja,4,6.1
64,1987,Paasam Oru Vesham,Jayadevi,"Ranjini, Madhuri, Disco Shanti, Vinu Chakravarthy, Nassar, Thyagu",null,Liberty Films,/w/index.php?title=Paasam_Oru_Vesham&action=edit&redlink=1,Shyam,6,7.5
65,1987,Parisam Pottachu,K. Chozha Rajan,"Karthik, Pandiyan, Ranjini, Madhuri, Senthil, S. S. Chandran",null,Kalaimani Movies,/wiki/Parisam_Pottachu,Manoj Gyan,6,
66,1987,Paruva Ragam,V. Ravichandran,"V. Ravichandran, Juhi Chawla, Jaishankar, Manorama",null,Sri Eswari Productions,/wiki/Paruva_Ragam,Hamsalekha,4,
67,1987,Per Sollum Pillai,S. P. Muthuraman,"Kamal Haasan, Raadhika, K. R. Vijaya, Goundamani, Manorama, Raveendran, Ramya Krishnan",null,AVM Productions,/wiki/Per_Sollum_Pillai,Ilaiyaraaja,7,6.9
68,1987,Pesum Padam,Singeetam Srinivasa Rao,"Kamal Haasan, Amala, Tinnu Anand, P. L. Narayana, Pratap K. Pothen, Farida Jalal",null,Mandakini Chitra,/wiki/Pushpaka_Vimana_(1987_film),L. Vaidyanathan,6,8.6
69,1987,Poo Mazhai Pozhiyudhu,V. Azhagappan,"Vijayakanth, Nadhiya, Suresh",null,Sri Rajakali Amman Movies,/w/index.php?title=Poo_Mazhai_Pozhiyudhu&action=edit&redlink=1,R. D. Burman,3,
70,1987,Poo Poova Poothirukku,V. Azhagappan,"Prabhu, Saritha, Amala, Rajeev, Senthil, Manorama",null,My Productions,/wiki/Poo_Poova_Poothirukku,T. Rajendar,6,
71,1987,Pookkal Vidum Thoodhu,Sreedhar Rajan,"T. Rajendar, Monisha Unni, Harish",null,Sri Sivahari Films,/w/index.php?title=Pookkal_Vidum_Thoodhu&action=edit&redlink=1,T. Rajendar,3,
72,1987,Poove Ilam Poove,Sirumugai Ravi,"Suresh, Nadhiya, Jaishankar, S. S. Chandran, Senthil, Sumithra",null,Vijaya Kala Pictures,/w/index.php?title=Poove_Ilam_Poove&action=edit&redlink=1,Ilaiyaraaja,6,7.2
73,1987,Poovizhi Vasalile,Fazil,"Sathyaraj, Karthika, Baby Sujitha",null,Lakshmi Priya Combines,/wiki/Poovizhi_Vasalile,Ilaiyaraaja,3,7.2
74,1987,Puyal Paadum Pattu,Manivannan,"Raghuvaran, Raadhika",null,Poompuhar Productions,/w/index.php?title=Puyal_Paadum_Pattu&action=edit&redlink=1,Ilaiyaraaja,2,
75,1987,Raja Mariyadhai,Karthick Raghunath,"Sivaji Ganesan, Karthik, Jeevitha, Janagaraj, Senthil, Sadhana",null,Kaiser Creations,/wiki/Raja_Mariyadhai,Sankar Ganesh,6,
76,1987,Rekha,N. Raghav,"Ilavarasan, Sandhya",null,Ashapriya Productions,/w/index.php?title=Rekha_(1987_film)&action=edit&redlink=1,,2,6.0
77,1987,Rettai Vaal Kuruvi,Balu Mahendra,"Mohan, Raadhika, Archana, V. K. Ramasamy, Thengai Srinivasan",null,Saagar Combines,/wiki/Rettai_Vaal_Kuruvi,Ilaiyaraaja,5,6.9
78,1987,Sattam Oru Vilayaattu,S. A. Chandrasekhar,"Vijayakanth, Radha, Ravichandran, Srividya, S. S. Chandran",null,V. V. Creations,/wiki/Sattam_Oru_Vilayaattu,Sankar Ganesh,5,7.5
79,1987,Shankar Guru,L. Raja,"Arjun, Seetha, Sasikala, Baby Shalini, Senthil, Manorama, Y. G. Mahendra",null,AVM Productions,/wiki/Shankar_Guru_(1987_film),Chandrabose,7,
80,1987,Sirai Paravai,Manobala,"Vijayakanth, Raadhika, Baby Shalini, Senthil, Y. Vijaya",null,Manthralaya Cine Creations,/wiki/Sirai_Paravai,Ilaiyaraaja,5,
81,1987,Solvathellam Unmai,Nethaji,"Vijayakanth, Rekha, Jaishankar",null,National Movie Makers,/wiki/Solvathellam_Unmai_(film),Thayanban,3,
82,1987,Thalidhaanam,R. C. Sakthi,"Rajesh, Lakshmi, Jayashree, Y. G. Mahendra",null,Annakkili V. Movies,/w/index.php?title=Thalidhaanam&action=edit&redlink=1,M. S. Viswanathan,4,
83,1987,Thambathyam,K. Vijayan,"Sivaji Ganesan, Ambika, Radha, V. K. Ramasamy, Thulasi, Prasad",null,Kalyani Cine Arts,/wiki/Thambathyam,Manoj Gyan,6,
84,1987,Thangachi,R. Krishnamurthy,"Ramki, Seetha, Pallavi, Radha Ravi, Nizhalgal Ravi, Senthil, S. S. Chandran, Anuradha",null,Rathna Movies,/wiki/Thangachi,S. A. Rajkumar,8,5.9
85,1987,Thaye Neeye Thunai,P. R. Somu,"K. R. Vijaya, Karthik, Pandiyan, Sudha Chandran, Senthil, S. S. Chandran",null,Sri Bhuvaneswari Kala Mandir,/wiki/Thaye_Neeye_Thunai,Sankar Ganesh,6,
86,1987,Theertha Karaiyinile,Manivannan,"Mohan, Rupini, Senthil, Janagaraj, Kovai Sarala",null,Kamala Chithram,/wiki/Theertha_Karaiyinile,Ilayaraja,5,
87,1987,Thirumathi Oru Vegumathi,Visu,"Pandiyan, Visu, Jayashree, Kalpana, S. Ve. Shekher, Nizhalgal Ravi, Kismu",null,Kavithalayaa Productions,/wiki/Thirumathi_Oru_Vegumathi,Sankar Ganesh,7,6.0
88,1987,Thulasi,Ameerjan,"Murali, Seetha, Chandrasekhar, Senthil, Charle, Thara",null,Veeralakshmi Combines,/wiki/Thulasi_(1987_film),Sampath Selvam,6,6.2
89,1987,Ullam Kavarndha Kalvan,Ashok Kumar,"Pandiarajan, Rekha, Nizhalgal Ravi, V. K. Ramasamy, Manorama, Kovai Sarala, Master Tinku",null,Appu Movies,/w/index.php?title=Ullam_Kavarndha_Kalvan&action=edit&redlink=1,Ilaiyaraaja,7,6.0
90,1987,Uzhavan Magan,R. Aravindraj,"Vijayakanth, Raadhika, Radha, Senthil, S. S. Chandran, Kovai Sarala",null,Ravuther Films,/wiki/Uzhavan_Magan,Manoj Gyan,6,
91,1987,Vairakkiyam,K. Vijayan,"Prabhu, Radha, Sowcar Janaki, Jaishankar, Manorama, Janagaraj",null,Sujatha Cine Arts,/wiki/Vairakkiyam,Manoj Gyan,6,
92,1987,Valayal Satham,Jeevabalan,"Murali, Bhagya, Raja, Madhuri, Chandrasekhar, M. N. Nambiar, Manorama, Janagaraj, Senthil",null,Balan Pictures,/wiki/Valayal_Satham,M. S. Viswanathan,9,
93,1987,Vanna Kanavugal,Ameerjan,"Karthik, Murali, Jayashree, Charle",null,Kavithalayaa Productions,/wiki/Vanna_Kanavugal,V. S. Narasimhan,4,
94,1987,Vaazhga Valarga,Vijaya Krishnaraj,"Pandiarajan, Radha Ravi, Saritha, Deepa, Senthil, Kovai Sarala",null,Niruma Creation,/w/index.php?title=Vaazhga_Valarga&action=edit&redlink=1,Ilaiyaraaja,6,
95,1987,Vedham Pudhithu,P. Bharathiraja,"Sathyaraj, Amala, Saritha, Raja, Janagaraj",null,Janani Art Creations,/wiki/Vedham_Pudhithu,Devendran,5,7.2
96,1987,Veerapandiyan,Karthick Raghunath,"Sivaji Ganesan, Vijayakanth, Raadhika, Jaishankar, Sumithra, V. K. Ramasamy, Anuradha",null,Prakash Pictures,/wiki/Veerapandiyan,Sankar Ganesh,7,5.7
97,1987,Veeran Veluthambi,Rama Narayanan,"Radha Ravi, Ambika, Chandrasekhar, Rekha, Senthil, S. S. Chandran",null,Sri Thenandal Films,/wiki/Veeran_Veluthambi,S. A. Rajkumar,6,
98,1987,Velaikaran,S. P. Muthuraman,"Rajinikanth, Amala, K. R. Vijaya, Sarath Babu, Pallavi, V. K. Ramasamy, Senthil",null,Kavithalayaa Productions,/wiki/Velaikkaran_(1987_film),Ilaiyaraaja,7,6.7
99,1987,Velicham,Sundar K. Vijayan,"Karthik, Ranjini, Nizhalgal Ravi, Sumithra, Senthil, Kovai Sarala",null,L. V. Creations,/wiki/Velicham,Manoj Gyan,6,
100,1987,Velundu Vinaiyillai,K. Shankar,"Vijayakanth, Ambika, M. N. Nambiar, Senthil, Vadivukkarasi",null,Om Muruga Arts,/wiki/Velundu_Vinaiyillai,M. S. Viswanathan,5,
101,1987,Vilangu,P. Jayadevi,"Jaishankar, Nizhalgal Ravi, Nalini, Arun Pandian, Ramya Krishnan, Sulakshana, Janagaraj",null,Bhanu Arts,/wiki/Vilangu,Shyam,7,
